track_id,track_name,lyrics
132630416,Neighbourhood,この頃ひどい夢を見る子供の頃の風景煙草の煙で満ちた白い食卓だ腐りかけの幸せ一日一切れずつ続く絶え間ないヒステリーあとは怠惰だけ平和も平和で反吐が出た遠く聞こえるバーバラアレンどうしたんだいなあ兄弟俺がわかるかい？お前が許せるくらいの大人になれたかなもういいかいなあ兄弟ここらでおしまいでなんて甘えてちゃお前にも嫌われちゃうのかな肩を寄せ合って生きていく小さな日陰の虫
84029649,Tabibito Dentou,ぼくは古い電燈砂漠の真ん中でひとり空に穴が開いてあかりが漏れる夜凍えた砂の上墓標の立ち並ぶ場所で息を吸い込んだ肺いっぱい吸い込んだ「誰か誰かぼくを探しておくれ寂しい夜をひとつ切り取っておくれ遠く遠く地の果てまで届くようにぼくは照らしているからいつでも」ぼくは古い電燈埃に塗れてはひとり枯れた井戸の縁に見知らぬ首飾りいつのまにかここは都市から砂漠へと変わり
84188470,Blue Jasmine,あなたの思い出話を聞く度強く感じているんだよ僕はその過去一つ残らず全てと生きていると差し出したジャスミンのお茶でさえ泣き出しそうな顔をして戸惑いながら口を付けたあなたを知っているよ沢山の道を選べるほど上手には生きられなかったけど心も体も覚えているあなたとなら生きていられるこれから僕らはどこへ行こう？ねえダーリン何処だろうときっととなりにあなたがいるならそれだけで特別なんだキスをして笑い合って悪戯みたいに生きていこう
84188461,Atashiwa Yuurei,らるららりららったるったったるらいららるららりららったるったったるらいららるららりららったるったったるらいららるららりららったるったったるらいら真っ赤な林檎に小さなランプ灯りが射し込んだソファの上であなたはいつものように眠ってあたしは鏡の中でひたすら悪夢が遠のくように祈ったあなたの瞳はいつだって綺麗で心の奥まで見透かすようだその水晶体が映す世界であたしはどうにか生きてみたくてひたすら心に檸檬を抱いたあたしはゆうれいあなたにみえないひとひらの想いも伝わらないそれでも愛をあたしの名前を
72147458,Living Dead Youth,さあ目を閉じたまま歩き疲れたこの廃墟をまたどこへ行こうそう僕らは未だ大人になれず彷徨ってまた間違ってこんな悲しみと痛みさえどうせ手放せないのならば全部この手で抱きしめては情動遊ばせて笑えるささあ呪われたまま笑い疲れたこの現世をまたどこへ行こうもう息も続かない喉も震えない失ってまた躊躇って｢嫌い｣を吊るしあげ帰りの会どうせ負けてしまうのならば弱いまま逃げてしまえたらいい消して消えない灯りの先へシクシク存在証明感動や絶望に泣いて歌う迷走エスオーエスの向こうに救命はないのを知っていたって
183554867,Deshomasho,如何でしょあたしのダンスダンスダンスねえどうでしょ？それなりでしょ？一人きり見よう見まねで憶えたよ凄いでしょ？異常な世界で凡に生きるのがとても難しい令月にして風和らぎまあまあ踊りましょるるらったったったった
130600450,Machi,街の真ん中で息を吸った魚が泣いた全て変わってしまった砂が落ちた生活が落ちた透明な朝に心像と何でもないような情操を愛を食べて動けない君へと大きすぎる灯りに逃げ出さない憔悴に抗わない日常を返したいその献身の先へ心は行く強くその諦観の奥へ言葉は行く深くほらー君の疑うものすべて
72147462,Melancholy Kitchen,あなたの横顔や髪の色が静かな机に並んで見えた少し薄味のポテトの中塩っけ多すぎたパスタの中あなたがそばにいない夜の底で嫌ってほど自分の小ささを見た下らない諍いや涙の中おどけて笑ったその顔の中誰もいないキッチン靡かないカーテンいえないいえないな独りでいいやなんて話そう声を出して明るい未来について間違えて凍えてもそばにいれるように笑って笑って笑ってそうやってきっと魔法にかかったように世界は作り変わってこの部屋に立ちこめた救えない憂鬱を
114976819,amen,Ah馬が走る黒いアスファルトの上荒んだ並木風もなし香りだす雨の気配Ah東京はフラスコの中の風景迷い込んでは泣いていたのは遠い遠い昔Ah光の澱に道草を誘う亡霊九つの門を通り抜けてあの山の麓へと空っぽの花瓶に活ける花を探している恥ずかしいくらい生き急いでいた遠い遠い昔お願いママパパこの世に生まれたその意味を
160316095,ごめんね,バカみたいな夢を笑わないで聞いてほしい日が暮れる前に話しておきたい君みたいに優しくなりたいだけ祈る声は激しくあと少しだけ心の底から触れ合うまで君と繋がっていたいだけ
